{
  "schema_version": 1,
  "allowed_licenses": ["Apache-2.0", "CC0-1.0", "MIT", "OFL-1.1"],
  "collections": [
    {
      "id": "figure-fixtures",
      "creator": "Alkahest project owner",
      "owner": "Alkahest project owner",
      "origin": "Original technical-book acceptance fixtures and deterministic derivatives",
      "created": "2026-08-19",
      "license": "CC0-1.0",
      "permission_evidence": "book/figures/README.md",
      "modifications": "Original assets; generated derivatives are rebuilt byte-for-byte from the listed sources.",
      "credit_text": "Alkahest technical-book acceptance fixtures, CC0 1.0.",
      "public_distribution": true,
      "source_files": [
        "figures/candidates/fischer-esterification-chemfig.tex",
        "figures/candidates/fischer-esterification-typed-smiles.typ",
        "figures/candidates/instruction-word-wavedrom.json",
        "figures/candidates/read-cycle-wavedrom.json",
        "figures/candidates/voltage-divider-circuitikz.tex",
        "figures/candidates/voltage-divider-zap.typ",
        "figures/data/computing-diagrams.json",
        "figures/data/physics-diagrams.json",
        "figures/data/response-time.csv",
        "figures/data/response-time.vl.json",
        "figures/source/build-dependency.dot",
        "figures/source/half-adder.mmd"
      ],
      "distributed_files": {
        "figures/generated/build-dependency-graph.svg": "d765de175f01e4834887db3ab7cf970b11d59055367b318b49d2097c62fdb041",
        "figures/generated/fischer-esterification.svg": "00c5bd86fb9d8f0411947c00ab53ffdceda0f8e472dc83712fab1b9e7ebe7d62",
        "figures/generated/half-adder-gates.svg": "55e852d625e03945e534bef7c5186847684b2a5703952571cfb931dd0fed4d55",
        "figures/generated/inverse-square-field.svg": "4d4fa08b836e90880490d3941fe810a41330bbdf4d72d4ac3a095dba7bcc8e78",
        "figures/generated/memory-instruction-layout.svg": "146cf8002c820e8657dd65eab449e418093eb805af88642c73c610cd2d3804c9",
        "figures/generated/processor-datapath.svg": "d9b47b55b2bad62af69eeae1253ae2cd24c9d516ebbbf743342d40fcc72751e1",
        "figures/generated/read-cycle-timing.svg": "096882041f3dfa4f177d793474def5cc18ff40fc2ea3c1e3d659e54d52e9d30a",
        "figures/generated/response-time.svg": "c57af84f66721da38b73e679e52978ab4a50b626c7b0840906b9dcdc7a7ed353",
        "figures/generated/velocity-vector.svg": "6645c211091003f44b3f3926313f4bc7b8dfb72672b941ba42826fccb13a23e2",
        "figures/generated/voltage-divider.svg": "23d3b64e3c9251e69fbfb5b021780e4e099698ac66a04cf7592f2641834cd2b8",
        "figures/signal-chain.svg": "a10badbdf1f972527c726765bae1b6b62f779d1f66ff659bf3ff1ca5a8303a6f",
        "figures/system-map-print.svg": "1be4372fc97836f956ede4c829e8f7e3985db6d6be4b8cc824085e60af30209b",
        "figures/system-map-screen.svg": "e2b0f32b86506f677af544bb26dc6b70ed7e3dd9f0533b21b352cd80800237f9",
        "figures/waveform-filtered.svg": "a5fd00ae0e92a74d33b0df15ef1da36be80780855d7c381bdfe26bd00209a0d4",
        "figures/waveform-raw.svg": "d74ef4655ba117864e892cecd8fd32d95066551a1362d6328359d67211fa83c8"
      },
      "coverage_globs": ["figures/*.svg", "figures/generated/*.svg"]
    },
    {
      "id": "semantic-icons",
      "creator": "Alkahest project owner",
      "owner": "Alkahest project owner",
      "origin": "Original semantic icon set created for this repository",
      "created": "2026-08-18",
      "license": "MIT",
      "permission_evidence": "book/icons/README.md",
      "modifications": "Original assets with no third-party source material.",
      "credit_text": "Alkahest semantic icons, MIT License.",
      "public_distribution": true,
      "source_files": [],
      "distributed_files": {
        "icons/danger.svg": "53cd28edd50636256de99cae81e659320e5c2f568264623ef21a4243dbd36711",
        "icons/equipment.svg": "c9546fc7fd507ba0ceba0832a6dcc1e6317a79ad21054b0af01f353b93747b6f",
        "icons/experiment.svg": "f5387e5c386af15541483e1d65b2a348959b41e1778fd7c9513d009e7047328d",
        "icons/idea.svg": "6afa2de451f95f683ab2aa7738e33decb4c5b5c7d80950858bba218fbcc9ad1b",
        "icons/optional-material.svg": "858fa8df63d47772c7dccc726f09abc8a0d813a14a11ef091057a805e5a1b51d",
        "icons/warning.svg": "447911fbfe17dee359a233038e88cac1aaf78e71f15d6f355af24d11cabad823"
      },
      "coverage_globs": ["icons/*.svg"]
    }
  ],
  "registries": [
    {
      "id": "rich-media",
      "path": "book/media.json",
      "root": "media",
      "file_fields": {
        "asset": "sha256",
        "fallback": "fallback_sha256",
        "transcript": "transcript_sha256",
        "captions": "captions_sha256"
      },
      "rights_defaults": {
        "owner": "Alkahest project owner",
        "permission_evidence": "Original-work declaration recorded in book/media.json and docs/media-workflows.md.",
        "modifications": "Original acceptance fixture; deterministic derivatives are checksum-locked.",
        "credit_text": "Alkahest rich-media acceptance fixture, CC0 1.0."
      }
    },
    {
      "id": "companion-materials",
      "path": "book/companion.json",
      "root": "companion",
      "file_fields": {"path": "sha256"},
      "rights_defaults": {
        "creator": "Alkahest project owner",
        "owner": "Alkahest project owner",
        "origin": "Original half-adder instructional companion fixture",
        "created": "2026-08-20",
        "license": "CC0-1.0",
        "permission_evidence": "Original-work declaration recorded in book/assets.json.",
        "modifications": "Original assets with no third-party source material.",
        "credit_text": "Alkahest half-adder companion fixture, CC0 1.0.",
        "public_distribution": true
      }
    }
  ],
  "runtime_bundles": [
    {
      "id": "quarto-site-libraries",
      "kind": "generated-runtime",
      "html_root": "site_libs",
      "provider": "Pinned Quarto 1.10.18 publishing image",
      "license_evidence": "Preserved upstream copyright/license headers and the pinned toolchain source",
      "required_markers": {
        "bootstrap/bootstrap.min.js": "Licensed under MIT",
        "clipboard/clipboard.min.js": "Licensed MIT",
        "quarto-html/anchor.min.js": "Licensed MIT",
        "quarto-html/popper.min.js": "MIT License",
        "quarto-nav/headroom.min.js": "License: MIT",
        "quarto-search/autocomplete.umd.js": "MIT License",
        "quarto-search/fuse.min.js": "Apache Software License 2.0"
      }
    },
    {
      "id": "embedded-fonts",
      "kind": "fonts",
      "html_root": "theme/fonts",
      "epub_root": "EPUB/fonts",
      "provider": "Checksum-pinned Libertinus 7.051 and Source Code Pro 2.042",
      "license": "OFL-1.1",
      "html_license_files": {
        "licenses/Libertinus-OFL.txt": "9aeecc8107c489ec1ec0068b0313e531a760edf3493705b32ab8ab8215a8794e",
        "licenses/Source-Code-Pro-OFL.md": "7c940e28a5388e9bba866cf0e408edda45fe0899ba98665b8f6ab31dc5e4b8ff"
      },
      "epub_license_markers": [
        "Copyright © 2012-2024 The Libertinus Project Authors",
        "© 2023 Adobe",
        "SIL OPEN FONT LICENSE Version 1.1"
      ]
    }
  ],
  "artifact_contract": {
    "html_root": "book/_build/html",
    "epub": "book/_build/epub/Alkahest-Reference-Book.epub",
    "pdf_policy": "config/pdf/preflight.json",
    "expected_pdf_title": "Alkahest Reference Book",
    "expected_pdf_author": "Barrett Otte",
    "expected_pdf_subject": "Alkahest Reference Book exercises the structure, typography, technical content, accessibility, rights, and reproducibility contracts needed by a reusable template for print, web, and EPUB publication. It is development evidence rather than a released book.",
    "expected_pdf_keywords": "book template, technical writing, self-publishing, Quarto, Typst, LuaLaTeX",
    "allowed_pdf_creator_patterns": ["^Typst 0\\.15\\.1$", "^LaTeX via pandoc$"],
    "allowed_pdf_producer_patterns": ["^$", "^LuaTeX-1\\.24\\.0$"],
    "forbidden_entry_patterns": [
      "(^|/)(\\.DS_Store|Thumbs\\.db|__MACOSX|\\.git|\\.env)(/|$)",
      "\\.(aux|bak|log|swp|tex|tmp|typ)($|/)"
    ],
    "forbidden_content_patterns": [
      {"label": "Unix home path", "pattern": "/(?:var/)?home/[A-Za-z0-9._-]+/"},
      {"label": "macOS home path", "pattern": "/Users/[A-Za-z0-9._-]+/"},
      {"label": "Windows home path", "pattern": "[A-Za-z]:\\\\Users\\\\[^\\\\]+\\\\"},
      {"label": "container build path", "pattern": "/workspace(?:/|\\b)"},
      {"label": "local file URL", "pattern": "file:///(?:home|Users|var|workspace)/"},
      {"label": "private key", "pattern": "BEGIN (?:RSA |OPENSSH |EC )?PRIVATE KEY"},
      {"label": "AWS access key", "pattern": "AKIA[0-9A-Z]{16}"},
      {"label": "GitHub token", "pattern": "gh[pousr]_[A-Za-z0-9]{20,}"}
    ]
  }
}
